{
  "entries": [
    {
      "blob_oid": "8b4f418686bab4393b2e76c324d904a26a9f7672",
      "content_sha256": "8516dadaca3b234291aedd32b5ee273df43bc17346eaafd96aa8b8b7cd9ab7da",
      "mode": "100644",
      "path": "src/capture/extractors/_shared.ts"
    },
    {
      "blob_oid": "9cfacb226d5e48d234f64e33593e0e3a5cd92c85",
      "content_sha256": "a03a3f7f25bc2eb56653d97b92f9bfb29feebb7813313d04983be01b56ed95ed",
      "mode": "100644",
      "path": "src/capture/extractors/_turn_meta.ts"
    },
    {
      "blob_oid": "765738abd3d717ce7ab4c77019e0d171f5db9f3b",
      "content_sha256": "2cc487f9c73aa50c00f0ff446b50e694b0d9f4628207bc1839a5d9bffabbd503",
      "mode": "100644",
      "path": "src/capture/extractors/claude-code.ts"
    },
    {
      "blob_oid": "e3c09e5df27cb1e77429f79f86c077f794135ffa",
      "content_sha256": "80628c0b422b0d4ea006a64da0a874307ef8a29c74c9ef6eaee23a1078fa7755",
      "mode": "100644",
      "path": "src/capture/extractors/codex.ts"
    },
    {
      "blob_oid": "7e1fd9bba47c643701e93d26674262906fbbe548",
      "content_sha256": "cccb31853b8f70e357a96741eceffe42d89ff443ca8013e86d31ac838df4a835",
      "mode": "100644",
      "path": "src/capture/extractors/cursor.ts"
    },
    {
      "blob_oid": "4b54ca9f625715f4a55123718e589f5d0e33203e",
      "content_sha256": "fedbf25838dc8ba9348e8b28c4fe4edb862175919fbf87f7693e9d65f620ca88",
      "mode": "100644",
      "path": "src/capture/gate.ts"
    },
    {
      "blob_oid": "9a1babc973dee13cec416bb70ac2f5e384c64f91",
      "content_sha256": "4498f85ca9ea6267158e93a1b50c64300c513294816a4a26d30ea975e818df2e",
      "mode": "100644",
      "path": "src/capture/git-state.ts"
    },
    {
      "blob_oid": "8664706bde86785fad87f525a6cfbc6bafb9610b",
      "content_sha256": "a2d2ad902920f21ab52a41c3f895aa82efeab7488a5d4e6ffdfcb06e44ea1990",
      "mode": "100644",
      "path": "src/capture/granola-source-policy.ts"
    },
    {
      "blob_oid": "dfa2bb254be7924bcd4cd66ad1111095494fe577",
      "content_sha256": "796d4552723ad1c9e09efa6de9c01716ec2eac810056eb0e47eb306d94fdfa06",
      "mode": "100644",
      "path": "src/capture/pipeline-core.ts"
    },
    {
      "blob_oid": "ba588cf54ae132e5de8dfcc4668e0281e4ac0da8",
      "content_sha256": "5f5b340847d70c3b126c3e73084674fa1b92ab303b7e71104c9b03ea44cfeb87",
      "mode": "100644",
      "path": "src/capture/pipeline.ts"
    },
    {
      "blob_oid": "f2af9a18271f470beed4c09fd2b425947c455f08",
      "content_sha256": "2e86eb8dfe57399308b646d3b12c1e2b8f8ece132389821b9a56499ccf027826",
      "mode": "100644",
      "path": "src/capture/sources.ts"
    },
    {
      "blob_oid": "fb648e121f573e3a121618bb38b347e4d82b4442",
      "content_sha256": "f6e8ab8f23becf3b8b5808020f1dd0c774ae05fbe7733a57d14ad32a0bbb2c7b",
      "mode": "100644",
      "path": "src/capture/surfaces/fs-watcher.ts"
    },
    {
      "blob_oid": "31ddb70edafae82ee277552a3107b0316fc0caa9",
      "content_sha256": "67d1ff5304d5e9d09ebbb71bb34227cffebf266d00b9a25ec17312e713d7827f",
      "mode": "100644",
      "path": "src/capture/surfaces/git-watcher.ts"
    },
    {
      "blob_oid": "ffd7b15f0d4d1bc36f06d37ae344ae2e793343f3",
      "content_sha256": "7d1ac043256510cd194613d7aaedf59c6875cf9e93d126383b34bd4ec816f713",
      "mode": "100644",
      "path": "src/capture/surfaces/granola-poller.ts"
    },
    {
      "blob_oid": "0fd16f664ab5d0506ea9944890d059b837850560",
      "content_sha256": "6e1e64ce24104fa806696a0c7e2a9492bba8e5daba902204a150bc684af4546f",
      "mode": "100644",
      "path": "src/capture/workspace-root.ts"
    },
    {
      "blob_oid": "7c57a3a0f808f2a353436413c91d2b591420db6a",
      "content_sha256": "904cf53589c798d6af861ea8d61f049fe843f2d9ee859f7f3f3ab922300aa405",
      "mode": "100644",
      "path": "src/echo-home/adapter-sync.ts"
    },
    {
      "blob_oid": "6f1d0dedc983a52ed6d328a26b0724e1b3cc2daa",
      "content_sha256": "f0f8db5e3d80843cc50c82af8a88e55054c546e2343364009e6817903ce4b45e",
      "mode": "100644",
      "path": "src/echo-home/adapters/atomic-write.ts"
    },
    {
      "blob_oid": "27449ace3b0a039a531594673c7c4355e1b8a453",
      "content_sha256": "6c2ae43810de1675f7e74b4440c576433f5e043d773f4a5b7cbd70e88b30429f",
      "mode": "100644",
      "path": "src/echo-home/adapters/claude-code-mcp.ts"
    },
    {
      "blob_oid": "a83d1a404c886ceb8761a2939ca2bee53abefb50",
      "content_sha256": "92ee087ba1f8cd4e92618be6e92285a250ddf31ce71cd40f29a594205efd27d3",
      "mode": "100644",
      "path": "src/echo-home/adapters/codex-config.ts"
    },
    {
      "blob_oid": "868909c9ac9c53f340528314208441cf749b024c",
      "content_sha256": "51b7f5b8ce153453d9af35bca48ecb099dfbb198020907c305d959277bd80bf0",
      "mode": "100644",
      "path": "src/echo-home/adapters/cursor-config.ts"
    },
    {
      "blob_oid": "e1b1bcc3acb0d8896f99b5519b74521dde546cb8",
      "content_sha256": "95984378739d971a4e0c2d8b5165f208daa3e15eb66f5e67c8a88639dcea28ba",
      "mode": "100644",
      "path": "src/echo-home/adapters/markers.ts"
    },
    {
      "blob_oid": "bf7f2b749fd022225ccfd35332f126294723a792",
      "content_sha256": "b24fa457bf74aa6a2db71471062c131b780a36cb88084ce1ab13e1d4d9d469b9",
      "mode": "100644",
      "path": "src/echo-home/adapters/role-sync.ts"
    },
    {
      "blob_oid": "ba1110a13ab8ae1bf4827a8ae12c99d5b8b05cad",
      "content_sha256": "e3b79406613f852dc51c14fff2ae9370090ea0d6c6ec303adad92d925bb331cc",
      "mode": "100644",
      "path": "src/echo-home/adapters/skill-sync.ts"
    },
    {
      "blob_oid": "be8a4cd4eef3ddca7796dba11eb6a4c58efeee2a",
      "content_sha256": "efab605ccf8cb493ca0e6ad743f8a6cc1e836cc0f3b207cbe4e179453ba57aef",
      "mode": "100644",
      "path": "src/echo-home/adapters/workflow-sync.ts"
    },
    {
      "blob_oid": "58750198e1e4283b2f346ca6a2055940d23b28f2",
      "content_sha256": "26ac2eaaaaa5b645b494672aadceb437fddca190a55ae1bbdd31a36cc7e77964",
      "mode": "100644",
      "path": "src/echo-home/index.ts"
    },
    {
      "blob_oid": "c0acd2f8286d423f263388911391a05787da91d6",
      "content_sha256": "81e71cf739120566305c4e2cebeca07b8f60ddef55013c6883abbc66f7a5b607",
      "mode": "100644",
      "path": "src/echo-home/paths.ts"
    },
    {
      "blob_oid": "cc1f8c4d5f95951732e4cd06b929e92b71ef7993",
      "content_sha256": "9c34157b11391d5982f232e1adf1e80ac5545d8c4667b760fd1ffa04e31d1c92",
      "mode": "100644",
      "path": "src/echo-home/roles.ts"
    },
    {
      "blob_oid": "573b3fa80303b333c60d84a2304708dda62420aa",
      "content_sha256": "8ac667c119a5df3e729af2b15a91fa78f7c64e3d7a2343d061d7869b03c55dc5",
      "mode": "100644",
      "path": "src/echo-home/scaffold.ts"
    },
    {
      "blob_oid": "bcf30e93c9648868e6ff2c8271059797e9d44773",
      "content_sha256": "d1c44e79d28e1d67de07ac7e349def697667d9b53a9472be7cadfaedf74bfd58",
      "mode": "100644",
      "path": "src/echo-home/state-paths.ts"
    },
    {
      "blob_oid": "3788b84ff260c4aff87e39a1d9631153d6163233",
      "content_sha256": "51df58febd78a3f9502391efe1880a8e8dc8fbedd9bc40610729d7283068b384",
      "mode": "100644",
      "path": "src/echo-home/wizard/adapter-cache.ts"
    },
    {
      "blob_oid": "69e4b2b5cca07c21d9779b6a82ec763d7c7dc098",
      "content_sha256": "a7ed0b11be21ef8bcc1c4292dbe5171316304574709895a5094a19478ef5bae9",
      "mode": "100644",
      "path": "src/echo-home/wizard/atom-store-readonly.ts"
    },
    {
      "blob_oid": "0135f0d4c74ce985a0f447d0542c4a3acadb5104",
      "content_sha256": "367948d3b4d9fdecbf0993eb25720e08ad550ffb0de77bc839e87428f0d48f85",
      "mode": "100644",
      "path": "src/echo-home/wizard/detect-agents.ts"
    },
    {
      "blob_oid": "4f916e51f54ba9c91c83fce684f83256f83cf3c9",
      "content_sha256": "755ce70bd1c0094a3599fafc67b0bd773745006e2079089734b433aedaf498d2",
      "mode": "100644",
      "path": "src/echo-home/wizard/detect-projects.ts"
    },
    {
      "blob_oid": "9bc1c34d5c4984c711315d4e0d3f71203c2a5f1a",
      "content_sha256": "8c9e65676d959e7e7b3e6b3662ddfcfe347da94da2b1648e42a78b23decfbc38",
      "mode": "100644",
      "path": "src/echo-home/wizard/index.ts"
    },
    {
      "blob_oid": "71c84619e64b2c4fe54977e5c971b32884876268",
      "content_sha256": "e370962259f8e6b1cbf9161d7c433ead7cb4d7f7272480967a84c80e5f04ea4e",
      "mode": "100644",
      "path": "src/echo-home/wizard/probe.ts"
    },
    {
      "blob_oid": "3705266f57b5fa76ce1c82ca6e68cbec86895ae7",
      "content_sha256": "390aff3dda464a2552d897262f73f2dcaca25e753beb850c8e63c5afb7530b7f",
      "mode": "100644",
      "path": "src/echo-home/wizard/render-echo-section.ts"
    },
    {
      "blob_oid": "a426f75abec4c6a2a38779e59e533bde9b597590",
      "content_sha256": "c00bd884ac183dda5239493a205da8f224bc2747b79dedae784eec3c836c5ecf",
      "mode": "100644",
      "path": "src/echo-home/wizard/run-wizard.ts"
    },
    {
      "blob_oid": "f92831c7fb121c8d43f84522481f335efd721da4",
      "content_sha256": "f6b3c81e35305182ef3624cd2a03d44eae9204939537ed134d8cd9ef8d5ad533",
      "mode": "100644",
      "path": "src/echo-home/wizard/wire.ts"
    },
    {
      "blob_oid": "8f17b1ced971eb63802a46f12f5029af34a4b41e",
      "content_sha256": "0b7ab8c54c1e644eb3a36813c1f3a932bdaad8b060abfb07f380bb77b39f4216",
      "mode": "100644",
      "path": "src/enrich/decision-drift.ts"
    },
    {
      "blob_oid": "19686604565b52a5ddd8e5adf70c9c2f6ff73dda",
      "content_sha256": "b06f9d48aed80d91f8b92e80893a531d472c200a90f4c44dd458fa005d27065e",
      "mode": "100644",
      "path": "src/enrich/dispatch.ts"
    },
    {
      "blob_oid": "137a9be8d16d59167d3ceaf51c740fec1a4e69fc",
      "content_sha256": "5a8f7d37c39b24a4c8b85893e5a97af683f34534fafdaa700e62301d56bd7d67",
      "mode": "100644",
      "path": "src/enrich/granola-intake-candidates.ts"
    },
    {
      "blob_oid": "babba581757d8ee1590235f78b09645eea01ebca",